{
  "$schema": "http://json-schema.org/draft-07/schema#",
  "$id": "Credential-Profile.json",
  "type": "object",
  "additionalProperties": false,
  "properties": {
    "$schema": {
      "$ref": "defs.json#/definitions/Schema"
    },
    "Name": {
      "type": "string",
      "description": "The name of the credential profile, as it is commonly called.  This is the name that should be used to refer to the credential profile in other documents and discussions"
    },
    "Credential Profile Description": {
      "type": "string",
      "description": "A brief description of the credential profile"
    },
    "Credential Format": {
      "allOf": [
        {
          "$ref": "../viewer/src/assets/schemas/fields.json#/definitions/Credential-Format"
        },
        {
          "description": "The format of the credential."
        }
      ]
    },
    "Signing Algorithm": {
      "allOf": [
        {
          "$ref": "../viewer/src/assets/schemas/fields.json#/definitions/Signing-Algorithm"
        },
        {
          "description": "The format of the signing algorithm."
        }
      ]
    },
    "Status Algorithm": {
      "allOf": [
        {
          "$ref": "../viewer/src/assets/schemas/fields.json#/definitions/Status-Algorithm"
        },
        {
          "description": "The format of the status algorithm."
        }
      ]
    },
    "Key Management (Issuer)": {
      "allOf": [
        {
          "$ref": "../viewer/src/assets/schemas/fields.json#/definitions/Key-Management"
        },
        {
          "description": "The format of the key management for the issuer."
        }
      ]
    },
    "Key Management (Holder)": {
      "allOf": [
        {
          "$ref": "../viewer/src/assets/schemas/fields.json#/definitions/Key-Management"
        },
        {
          "description": "The format of the key management for the holder."
        }
      ]
    },
    "Issuance Protocol": {
      "allOf": [
        {
          "$ref": "../viewer/src/assets/schemas/fields.json#/definitions/Issuance-Protocol"
        },
        {
          "description": "The format of issuance protocol."
        }
      ]
    },
    "Presentation Protocol": {
      "allOf": [
        {
          "$ref": "../viewer/src/assets/schemas/fields.json#/definitions/Presentation-Protocol"
        },
        {
          "description": "The format of the presentation protocol."
        }
      ]
    },
    "Trust Management": {
      "allOf": [
        {
          "$ref": "../viewer/src/assets/schemas/fields.json#/definitions/Trust-Management"
        },
        {
          "description": "The format of the trust management."
        }
      ]
    },
    "Formal Specification": {
      "type": "string",
      "description": "A link to a formal specification of the credential profile."
    }
  },
  "required": [
    "$schema",
    "Credential Format",
    "Credential Profile Description",
    "Name",
    "Key Management (Holder)",
    "Key Management (Issuer)",
    "Signing Algorithm"
  ],
  "title": "CredentialProfile"
}
