{
  "$schema": "../../schemas/Credential-Profile.json",
  "Name": "HAIP",
  "Credential Profile Description": "OpenID4VC High Assurance Interoperability Profile with SD-JWT-VC",
  "Formal Specification": "https://vcstuff.github.io/oid4vc-haip-sd-jwt-vc/draft-oid4vc-haip-sd-jwt-vc.html#name-authors-addresses",
  "Credential Format": "SD-JWT-VC",
  "Signing Algorithm": "ECDSA",
  "Status Algorithm": "JWT/CWT status list",
  "Key Management (Issuer)": ".well-known/jwt-issuer",
  "Key Management (Holder)": "raw public keys (jwk)",
  "Issuance Protocol": "OpenID4VCI",
  "Presentation Protocol": "OpenID4VP"
}
