{
  "$schema": "../../schemas/Credential-Profile.json",
  "Name": "AnonCreds with cardano blockchain",
  "Credential Profile Description": "AnonCreds with cardano blockchain",
  "Credential Format": "AnonCred",
  "Signing Algorithm": "CL",
  "Key Management (Issuer)": "did:web",
  "Key Management (Holder)": "link secrets",
  "Trust Management": "Verifier knows Issuers",
  "Formal Specification": "https://github.com/roots-id/cardano-anoncreds/blob/main/cardano-anoncred-methods.md"
}
