{
  "$schema": "../../schemas/Credential-Profile.json",
  "Name": "JWT VC Presentation Profile 2",
  "Credential Profile Description": "https://identity.foundation/jwt-vc-presentation-profile/",
  "Credential Format": "JWT-VC",
  "Signing Algorithm": "ECDSA",
  "Status Algorithm": "Status List 2021",
  "Key Management (Issuer)": "did:web",
  "Key Management (Holder)": "did:ion (long form)"
}
